Question,A,B,C,D,Correct Answer,Feedback / Explanation
A legal life estate is created by,federal law,state law,family members,freehold estates,b,A legal life estate is created by state law as opposed to being created by a property owner's agreement. Provisions vary from state to state. The focus of a legal life estate is defining and protecting the property rights of surviving family members upon the death of the husband or wife
The principal interests accompanying the legal life estate are the ,"remainderman, reversion and pur autre vie",freehold and leasehold estates,same as ordinary life estates,"homestead, dower and curtesy, and elective share",d,"The principal interests conveyable in a legal life estate are the homestead, dower and curtesy, and elective share"
Which of the following statements regarding the general provisions of the homestead laws is true?,"The homestead exemption is also known as the homestead tax exemption, which exempts a portion of the property's value from taxation",The homestead interest can be conveyed by one spouse; both spouses do not need to sign the deed conveying the homestead property,The homestead laws can be applied to any investment property that that is owned by a married couple,The homestead laws protect family members against losing their homes to general creditors attempting to collect on debts,d,A homestead is one's principal residence. Homestead laws protect family members against losing their homes to general creditors attempting to collect on debts
"If a tenant with a leasehold estate for years remains in possession of the leased premises after lease expiration, a(n) ___________ is created.",adverse lease,estate lease,hang-on lease,holdover lease,d,"If a tenant with a leasehold estate for years remains in possession of the leased premises after lease expiration, a holdover lease is created. In the absence of a new lease agreement stating otherwise, the holdover tenancy becomes a periodic tenancy."
"Two people own a house, each having an undivided equal interest.  Which of the following best describes what they own?",Each owns fifty percent of the physical house and the land it rests on,Each owns one hundred percent of the physical house and the land it rests on,"Each owns fifty percent of the estate represented by the real property, but no physical portion of the real property",Each owns one hundred percent of the estate represented by the real property and fifty percent of the physical house and the land it rests on,c,"An undivided interest is an owner's interest in a property in which two or more parties share ownership. The terms ""undivided"" and ""indivisible"" signify that the owner's interest is in a fractional part of the entire estate, not in a physical portion of the real property itself. If two co-owners have an undivided equal interest, one owner may not lay claim to the northern half of the property for his or her exclusive use"
An interest in real estate that includes the right to possess is considered,an estate in land,a freehold estate,a fee simple estate,an encumbrance,a,"Interests are principally distinguished by whether they include possession. If the interest-holder enjoys the right of possession, the party is considered to have an estate in land, or, familiarly an estate"
An interest in real estate that does not include the right to possess is considered,a leasehold interest,a fee simple estate,an encumbrance,a tenancy,c,"Interests are principally distinguished by whether they include possession. If a private interest-holder does not have the right to possess, the interest is an encumbrance"
The right to zone land and the right to acquire ownership of land by eminent domain are both examples of,a public interest,a possessory interest,an encumbrance,an estate in law,a,"Interests are principally distinguished by whether they include possession. If the interest-holder is not private, such as a government entity, and does not have the right to possess, the interest is some form of public interest"
"If the duration of an owner's rights in an estate cannot be determined, the owner possesses",an indeterminate legal estate,a leased fee simple estate,a freehold estate,a leasehold estate,c,"Freehold estates are ownership estates, and their duration cannot be determined; that is to say that the ownership rights may endure for a lifetime, for less than a lifetime, or for generations beyond the owner's lifetime"
The distinguishing feature of a leasehold estate is,ownership of an interest by a tenant,temporary ownership of the full bundle of rights in a property,unlimited ownership of one right in the bundle of rights in a property,duration limited by a lease term,d,"A leasehold estate is distinguished by its specific duration, as represented by the lease term. Further, leasehold tenants only enjoy limited property rights: use; temporary possession, and limited exclusion"
Which of the following is a freehold tenant?,The owner of a freehold estate,The lessee in a leased property,The lessee of a freehold estate,Any owner of an estate in land,a,The owner of the freehold estate is the freehold tenant
In what kind of estate does ownership revert to the grantor of the estate if usage fails to conform to a stated condition in the grant?,Fee simple absolute,Life estate with reversion,Life estate with condition subsequent,Fee simple defeasible,d,"The defeasible fee estate is perpetual, provided the usage conforms to stated conditions"
"Bob grants his sister Mary an estate for as long as she lives, but her heirs cannot inherit the estate.  What kind of estate is it?",An estate pur autre vie,An estate for years,An ordinary life estate,A legal life estate,c,An ordinary life estate ends with the death of the life estate owner and may pass back to the original owners or their heirs (reversion) or to a named third party (remainder)
"Homestead, dower and curtesy, and elective share are examples of",a conventional life estate,a legal life estate,an estate created by an owner's agreement,a fee simple absolute,b,"The major forms of legal life estate are the homestead, dower and curtesy, and elective share"
"To convey clear title in a dower and curtesy state,",both spouses must release their interest to the other spouse,both spouses must sign the conveyance,"there must be two separate conveyances, each signed by one spouse",the head of household must sign the conveyance,b,"To transfer property within dower and curtesy states, the husband (or wife) must obtain a release of the dower interest from the other spouse in order to convey clear title to another party. If both parties sign the conveyance, the dower right is automatically extinguished"
States that do not have dower and curtesy usually have either community property laws or,descent by escheat,elective share,share by the entireties,judicial election,b,Dower and curtesy laws have been largely supplanted by community property laws and elective share laws
Which of the following rights is conveyed with a leasehold estate?,The right to exclude everyone from the premises,The right to encumber the fee interest,The right to sell the premises,The right to possess and use the premises,d,Leasehold tenants are entitled to possess and use the leased premises during the lease term in the manner prescribed in the lease
An estate from period-to-period will continue as long as,"the tenant makes, and landlord accepts, regular rent payments",the term specified in the lease,the period is less than a year,the landlord has not given notice of termination,a,"In an estate from period-to-period, also called a periodic tenancy, the tenancy period automatically renews as long as the tenant pays rent in a timely manner and the landlord accepts it. At the end of a tenancy period, if the landlord accepts another regular payment of rent, the leasehold is considered to be renewed for another period. A conveyance of leased property does not cancel a leasehold interest"
An estate at will,cannot be terminated,is terminated only if so stated in the lessee's last will and testament,terminates on the death of lessor or lessee,terminates on the date specified in the lease agreement,c,"The estate at will, also called a tenancy at will, has no definite expiration date and hence no ""renewal"" cycle. The landlord and tenant agree that the tenancy will have no specified termination date, provided rent is paid on time and other lease conditions are met. For example, a son leases a house to his father and mother ""forever,"" or until they want to move. The estate at will is terminated by proper notice, or by the death of either party"
"If a tenant occupies a leased property without the consent of the landlord after a lease expires, the type of estate that results is called ",an estate at sufferance,a holdover estate,an adverse leasehold,a hostile leasehold,a,"In an estate at sufferance, a tenant occupies the premises without consent of the landlord or other legal agreement with the landlord. Usually such an estate involves a tenant who fails to vacate at the expiration of the lease, continuing occupancy without any right to do so"
An interest in real estate is best defined as ownership of,the full bundle of rights to real property,an estate,one or more of the bundle of rights to real property,the right to possession and use of real property,c,"An interest in real estate is ownership of any combination of the bundle of sticks, including the rights to possess, use, transfer, encumber and exclude"
Encumbrances and police powers are,interests that do not include possession,limited forms of an estate,unrelated to interests,types of public interests,a,An encumbrance enables a non-owning party to restrict the owner's bundle of rights. Government entities also have nonpossessory interests in real estate which act to control land use for the public good within the entity's jurisdiction. The prime example of public interest is police power
What distinguishes a freehold estate from a leasehold estate?,A freehold includes the right to dispose or use,A leasehold endures only for a specific period of time,A freehold cannot be defeasible,A leasehold is subject to government restrictions,b,"Freehold estates are ownership estates, and their duration cannot be determined. A leasehold endures only for a specific period of time"
The highest form of ownership interest one can acquire in real estate is the,dower and curtesy,conventional life estate,defeasible fee simple estate,absolute fee simple estate,d,"The fee simple freehold estate is the highest form of ownership interest one can acquire in real estate. It includes the complete bundle of rights, and the tenancy is unlimited, with certain exceptions. The fee simple absolute estate is a perpetual estate that is not conditioned by stipulated or restricted uses"
The distinguishing feature of a defeasible fee simple estate is that,it can be passed on to heirs,it has no restrictions on use,the estate may revert to a grantor or heirs if the prescribed use changes,it is of unlimited duration,c,"The defeasible fee estate is perpetual, provided the usage conforms to stated conditions. Essential characteristics are: the property must be used for a certain purpose or under certain conditions; and, if the use changes or if prohibited conditions are present, the estate reverts to the previous grantor of the estate"
"Upon the death of the owner, a life estate passes to",the original owner or other named person,the owner's heirs,the state,the owner's spouse,a,"Upon the death of the owner or other named individual, the estate passes to the original owner or another named party"
How is a conventional life estate created?,It happens automatically when title transfers unless a fee simple is specifically claimed,A fee simple owner grants the life estate to a life tenant,It is created by judicial action,It is created by a statutory period of adverse possession,b,"A conventional life estate is created by grant from a fee simple property owner to the grantee, the life tenant"
What distinguishes a pur autre vie life estate from an ordinary life estate?,The pur autre vie estate endures only for the lifetime of the grantor,The pur autre vie estate endures only for the lifetime of the grantee,The pur autre vie estate endures only for the lifetime of a person other than the grantee,The pur autre vie estate cannot revert to the grantor,c,"A pur autre vie life estate endures over the lifetime of a third person, after which the property passes from the tenant holder to the original grantor (reversion) or a third party (remainderman)"
Which of the following life estates is created by someone other than the owner?,Conventional life estate,Ordinary life estate,Legal life estate,Community property life estate,c,A legal life estate is created by state law as opposed to being created by a property owner's agreement
Which of the following is true of a homestead?,A homestead interest cannot be conveyed by one spouse,A homestead interest cannot be passed to the children of the head of household,A homestead interest is a form of conventional life estate,A homestead is a primary or secondary residence occupied by a family,a,A homestead is one's principal residence. Homestead laws protect family members against losing their homes to general creditors attempting to collect on debts. Homestead laws generally provide that: the homestead interest cannot be conveyed by one spouse; both spouses must sign the deed conveying homestead property
Dower refers to,joint tenancy of husband and wife,a wife's life estate interest in her husband's property,a wife's homestead interest,a child's life estate interest in his or her parents' homestead,b,"Dower refers to a wife's life estate interest in the husband's property. When the husband dies, the wife can make a claim to portions of the decedent's property. Curtesy is the identical right enjoyed by the husband in a deceased wife's property. Property acquired under dower laws is owned by the surviving spouse for the duration of his or her lifetime"
Which of the following is an illustration of the legal concept of elective share?,A surviving spouse places a lien on a debtor's property,A widow who was excluded from a will makes a claim to a portion of the couple's principal residence,A spouse who loses her home because of her husband's gambling debt sues in court for exemption from the debt,A widower whose spouse died without a will sues to change the provisions of the will,b,Elective share is a state-level statute enabling a surviving spouse to make a minimum claim to the deceased spouse's real and personal property in place of the provisions for such property in the decedent's will
"A one-year lease on a house has expired, but the tenant continues sending monthly rent checks to the owner, and the owner accepts them. What kind of leasehold estate exists?",Estate for years,Estate from period to period,Estate at will,Estate at sufferance,b,"In an estate from period-to-period, also called a periodic tenancy, the tenancy period automatically renews for an indefinite period of time, subject to timely payment of rent. At the end of a tenancy period, if the landlord accepts another regular payment of rent, the leasehold is considered to be renewed for another period"
"If a lien covers all properties of the debtor in that county where it is recorded, it is known as:",Specific lien,Judgment lien,Lis pendens,General lien,D,"General Liens applies to and burdens all of the owner's real property, but only in the county of recording. [Examples include tax liens or liens resulting from a court judgment.]. Therefore a judgment lien is not the answer because it is one of many other types of general liens."
"Generally, construction onto the property of another, like a wall fence, building, etc. is known as what?",Encroachment,Easement appurtenant,Estoppel,Situs,A,"When you think of the word encroachment you think of somebody stepping over a line from their side on to yours. An encroachment is the physical intrusion of a structure or improvement on the land of another. Examples can also include a fence or driveway over the property line. Remember your property line extends upwards to the sky therefore a tree hanging over on to your property is encroachment as well. An encroachment can be found by a survey. It is a form of trespass, therefore when an encroachment occurs you may be able to sue your neighbor for trespassing."
Which of the following would be considered real property?,Diamonds which have been mined,Trade fixtures,Bearing wall,A cell phone,C,"Real property is that category of property that is immovable by law. Examples include load bearing walls, stock in a mutual water company, and minerals."
Personal property can be:,"turned into real property, alienated, and/or hypothecated.",alienated.,hypothecated.,turned into real property.,A,Personal property are items that are generally moveable and do not go with the real estate. Personal property can be turned into real property (such as in a fixture) it can be alienated (you can get rid of it) and it can be hypothecated (pledged as collateral to secure a loan).
Which of the following would likely be defined as a fixture?,Area rugs in a home,A built-in stove in a mobile home,Crops after harvest,Something incorporated into the land,D,"Fixtures are objects attached to real property or incorporated into the land which are now considered real property. To determine whether or not an item of Personal Property has become a Fixture, use the Maria test: Method, Adaptability, Relationship, Intention, Agreement. The size, cost and time of attachment are NOT factors. Mobile homes are generally not considered real property because they're not attached to the land, so a stove in a mobile home is not usually a fixture."
Which of the following would be most likely found in a business office?,None of the other options are correct,An easement,A fixture,A trade fixture,D,"Trade Fixtures are items that are attached to the property, but they are not considered real property because they are in a business office. They can leave with the person as they do not stay with the property. Trade fixtures are not appurtenant to the land because they are personal property. Always keep in mind to choose the best answer."
"Zena granted the property to Ungrilda, but because she knew that Ungrilda had a drinking problem she told her that there was a condition. The condition was that the property would be forfeited if alcohol is sold on the premise. Ungrilda would have which of the following estates?",Fee Simple Defeasible,Estate in Sufferance,Fee simple Absolute,Life Estate,A,"A Fee Simple Defeasible puts conditions on the use of a property. For example, an owner could lose title if the condition that no alcohol is sold on the property is violated."
"The holder of a life estate, based on her own life, may do all of the following, except:",borrow against the property.,sell the property.,devise the property.,lease the property.,C,"A Life Estate is a type of Freehold Estate which has a duration measured by the length of someone's life, after which the estate passes to a reversionary or remainder interest-holder. A life estate measured by the holder's life cannot be devised, but it can be borrowed against, leased or sold (though the purchaser will lose any rights when the life-estate holder dies and the property passes to the reversionary or remainder interest-holder)."
"Placing two or more contiguous units under common ownership, for the purpose of increasing the value per unit, is known as:",plottage.,disassemblage.,severalty ownership.,terminus ownership.,A,Plottage is the common ownership of two or more units or lots next to each other which makes the value of the new combined property greater than the values of each individual lot added together. Assemblage is the process by which plottage occurs.
"A situation in which the tenant's lease has expired, the tenant is no longer paying rent and is living on the property without permission is known as:",estate from period to period.,estate at will.,estate at sufferance.,an estate for years.,C,"In an estate at sufferance, the tenancy is by a lessee who lawfully occupies the landlord's property, but then continues to occupy the property improperly after his rights have expired and without permission of the landlord. Think of it this way: The landlord and the estate are SUFFERING because rent is not being paid. The other types of estates mentioned here are actual lease agreements, but this is a situation of one party being unwilling to abide by the terms of any agreements previously reached."
The right-of-way to access telephone lines is a common example of:,an easement in gross.,an easement appurtenant.,a non-revocable license.,a legally valid encroachment.,A,"An easement in gross grants a company or individual limited rights to access another's property for a specific purpose. In this case installing, maintaining and repairing telephone lines."
Title held by a husband and wife may include all of the following forms of ownership EXCEPT:,joint tenancy,tenancy by the entireties,tenancy in common,severalty,D,"Severalty means sole ownership and, other than forming a corporation, spouses can only hold property in common through some form of joint ownership."
Mary owns one parcel of land and is trying to show that exceptional circumstances exist that justify using the land in a way that is prohibited by current zoning laws. Her intended use would not be detrimental to the public. She would probably petition the planning commission for a:,Redevelopment permit,Variance,Building permit,Rezoning agreement,B,A petition for variance is a method by which a landowner can try to show that unique circumstances exist and that his land should be allowed an exception to present zoning laws. Variance is done lot by lot.
The difference between a judgment lien and a mechanic's lien is:,mechanic's liens are created by statute.,mechanic's liens may take priority earlier than the date they are recorded.,judgment liens are involuntary liens.,judgment liens are not enforceable until recorded.,B,"Mechanic's liens take priority as of the first day of construction, and may even take priority earlier than their date of recording."
"Unless otherwise specified, the rights to minerals which lie beneath the surface of land:",Cannot be conveyed apart from the real estate surrounding the minerals.,Are kept by the original grantor;,Are automatically transferred with the sale of the real property;,Cannot be leased;,C,"Appurtenances are said to ""Run with the Land"" and they require no separate conveyance. Appurtenances include Easements, Stock in a Mutual Water Company, Covenants, and Minerals. They are considered real property."
Real estate brokers can have difficulty with personal property because ownership rights and identification are often difficult to determine. This is because personal property can:,"be alienated, hypothecated and can become real property.",be alienated only.,become real property only.,be hypothecated only.,A,"Personal Property, also known as ""chattel"", is a category of property that is generally movable and can be hypothecated (pledged as collateral), alienated (transfer of ownership) and become real property (as a fixture)."
"""Of indefinite duration"" is a characteristic which is particularly descriptive of an:",Estate less-than-freehold.,Estate for years.,Estate of inheritance.,Estate from period-to-period.,C,"Fee Simple Estate: Also referred to as an ""Estate of Inheritance"", a Fee Simple Estate is one type of Freehold Estate, and as such, is indefinite in duration. A Fee Simple Estate can also be sold or inherited, and is not free of Encumbrances. A Fee Simple Absolute is the most interest that one can hold in land."
A freehold estate consists of:,A fee estate;,A leasehold estate.,An estate from period to period;,An estate at will;,A,"Freehold estate is an estate in which ownership is for an indeterminate length of time, that would be ""fee estate""; the other options are all examples of less than freehold estates."
"The deed restrictions on a subdivision said that the lots must contain a minimum of 15,000 square feet structure. The zoning restrictions said that the lots must contain a minimum of 10,000 square feet structure. Which would prevail in this situation?",Zoning restrictions,The one recorded last,Deed restrictions,The one recorded first,C,"The higher standard of restrictions will usually prevail. For example, if deed restrictions in a subdivision required that each lot contain a minimum 15,000 square feet structure, and the applicable zoning laws required that each lot contain a minimum 10,000 square foot structure, the deed restrictions would prevail. With things like this, you usually go with the option that is more restrictive. NOTE - This question asks about the MINIMUM square footage of a structure, so the more restrictive number is 15,000 sq. ft. If the question asked about the MAXIMUM square footage of a structure, the more restrictive number would be 10,000 sq. ft."
"When the rent charged is based on the gross sales of a business, the lease is correctly termed:",A percentage lease;,A voidable lease;,A net lease;,A gross lease;,A,"Percentage Leases: In this type of lease, the amount of rent paid by the lessee is determined by calculating a percentage based on the gross receipts of the lessee's business (i.e., a commercial parking lot)."
