Question,A,B,C,D,Correct Answer,Feedback / Explanation
A property owner deeds a parcel of his property to a town "for recreational purposes only." The deed conveys to the town a,life estate.,fee simple defeasible estate.,leasehold estate.,fee simple absolute estate.,B,"The deed conveys a fee simple defeasible estate which includes a specific condition on the use of the parcel. If the town uses the parcel for any purpose other than for recreational use, the property owner can take possession of the property through legal action. Holder of a leasehold estate has no ownership only possession. A fee simple absolute estate has no restrictions on the use of the property. A life estate is limited in duration to the life of the owner of the estate or to the life of some other designated person."
A tax lien on a property can hinder the sale of the property because it is a(n):,encroachment.,encumbrance.,general lien and will attach to the real and personal property.,monetary charge that the purchaser must satisfy.,B,"An encumbrance is a claim, charge, or liability that attaches to real estate. It is a right or interest held by someone else other than the fee owner of the property that affects the title. A tax lien is a specific lien attached to the real property when real estate property taxes are not paid by the owner. It is not an encroachment, which is an illegal extension of a building or structure onto another's property. A purchaser is not required to satisfy a tax lien unless agreed to by the purchaser in the purchase contract."
"In receiving a gift of a parcel of real estate, one of the two new owners was given an undivided 60% share, and the other received an undivided 40% share. They now hold title as",tenants in common.,community property owners.,joint tenants.,cooperative owners.,A,"Tenants in common hold property with undivided fractional interests, and the shares do not have to be equal. In a joint tenancy, each owner holds equal shares and interests to the property. Community property consists of personal or real property acquired by either party in a marriage and belonging to both parties to the marriage. In a cooperative, owners own shares in a corporation, partnership or trust which owns a property, with each owner holding a proprietary lease and the right to occupy the unit."
"Sally conveys a life estate to Scott for his lifetime and designates Bill as the person to whom the property will pass when the life estate ends. When Scott dies, what happens to the property?",The property reverts back to the original property owner.,The property passes to Scott's heirs.,Bill automatically becomes the fee simple owner of the property.,Sally must designate a remainderman for the property.,C,"The property owner named Bill as the remainderman, the one to whom the property would pass upon the death of Scott. On Scott's death, the life estate ends, and the property automatically passes to Bill. If the property owner does not choose a remainderman when conveying the life estate to Scott, ownership reverts back to the original property owner or to her heirs."
What is the difference between a general lien and a specific lien?,"A general lien affects all of a debtor's property, while a specific lien affects only a certain piece of property.","A specific lien covers real estate, while a general lien covers personal property.","A general lien cannot be enforced in court, while a specific lien can be enforced.","A specific lien is held by one person, while a general lien is held by at least two people.",A,"A general lien affects all of a debtor's property, both real and personal. A specific lien affects only a particular piece of real or personal property. Both general and specific liens may be enforced in court."
Which lien affects all real and personal property of a debtor?,General,Involuntary,Specific,Voluntary,A,"A general lien attaches to all of a debtor's real and personal property as opposed to a specific lien, which affects only a particular piece of real or personal property. A voluntary lien, such as a mortgage, is placed on a property with the consent of the owner. An involuntary lien is imposed upon a property without the consent of the owner."
One major difference between joint tenancy and tenancy in common is:,joint tenancy requires all ownership rights to be acquired at the same time.,"tenants in common have a separate legal title, which allows them to have divided interests.",tenants in common have survivor rights for each owner.,"joint tenants have equal rights of possession, while tenants in common do not.",A,"Joint tenancy (which offers the right of survivorship) requires PITT- possession, interest and title must all occur at the same time. Tenants in common owners have equal rights of possession but may have unequal rights of ownership. All owners, regardless of how ownership is taken, share one deed which conveys legal title."
Which of the following best describes fee simple absolute estate?,It is the maximum estate in land.,The duration is dependent upon the language of the deed.,It will have the maximum rights unless a deed condition limits.,It is the maximum estate in land but lasts only for the duration of the property ownership.,A,"Fee simple absolute estates, which have the largest (maximum) bundle of rights, are typically transferred from one owner to another when title is passed so they continue forever- there is no time limit to the duration of property ownership. A deed condition would create a fee simple defeasible or qualified estate."
"An ownership interest that is based on occupancy during a specified period of time, is a:",time-share.,tenancy-at-will.,cooperative.,condominium.,A,"A real property interest with the right to use the facilities for a certain period of time is called a time-share. While a time-share may be sold as a leasehold or freehold interest, time-share intervals are usually shorter intervals of time, typically weekly intervals. A leasehold interest occurs when a tenant leases a property from an owner but usually for an extended longer period of time (such as one year). A condominium owner holds a fee simple absolute ownership to the unit and owns the common elements as tenants in common with the other owners. In a cooperative, tenants own shares in a corporation, partnership or trust that holds title to the building, with tenants having the right to occupy their own units but do not have a deed."
Two friends bought a store building and took title as joint tenants. One woman died testate. The surviving woman now owns the store:,as a tenant in common with the dead woman's heirs.,in severalty.,as a joint tenant with rights of survivorship.,in trust.,B,"Joint tenancy includes the right to survivorship, which means the property passes to the surviving owner(s) upon the death of one tenant. In this case, the women took title as joint tenants. When one woman died, her share passed to the other owner who now owns the property in severalty."
Which of the following about a condominium is FALSE?,Each unit owner owns the common elements as tenants in common with all other unit owners,Each owner has a proprietary lease with the association for their own unit,Each owner receives a separate real estate tax statement,Each owner must carry their own property insurance,B,"In a condominium, each owner has fee simple title to the unit while owners of cooperatives have proprietary leases. In a condominium, each owner owns the common elements as tenants in common with all other unit owners. Each owner receives a separate real estate tax statement. Each owner of a condominium unit must carry their own property casualty insurance on the individual unit based upon the condominium declaration. The association carries insurance for the common elements. NOTE - This question asks ""Which of the following statements... is FALSE"" which means it's looking for a false answer, and it's false that each owner of a condominium has a proprietary lease."
"When a company furnishes materials for the construction of a house, and the company is NOT paid, it may file a",lis pendens.,mechanic's lien.,default judgment.,deficiency judgment.,B,A mechanic's lien gives security to persons or companies that perform labor or furnish material to improve real property and can be filed when the owner has not fully paid for the work. Lis pendens is a recorded notice of a suit that may affect title to real property. A default judgment is granted when a creditor files for unpaid bills and wins the right to place a general lien on all the debtor's property to collect payment. A deficiency judgment is a personal judgment a lender may file against a borrower for the unpaid balance on a mortgage loan when a foreclosure sale has not produced enough cash to pay the loan balance.
An owner conveys a life estate to her grandson and stipulates that on her death the estate will pass to her son-in-law. The son-in-law has a(n),remainder interest.,reversionary interest.,estate for years.,legal life estate.,A,"The owner's death will end the life estate conveyed to her grandson, which will then mean the holder of the remainder interest, the son-in-law, will have fee simple absolute ownership of the property. An estate for years is a leasehold estate that continues for any definite period of time. A legal life estate is a freehold estate created out of a provision."
"Because a homeowner failed to pay her real estate property taxes on time, the taxing authority imposed a claim against her property. This claim is known as a(n)",easement.,deed restriction.,reversionary interest.,lien.,D,The claim is a tax lien. Unpaid real estate property taxes are a lien on the property as they are a charge against the property that provides security for a debt or an obligation for payment by the property owner. A deed restriction creates a limitation on the use of a property. An easement is the right of one party to use the real property of another for a specific use. A reversionary interest is the ownership interest belonging to the creator of a life estate when the ownership reverts to the original owner upon the end of the life estate.
Four friends decide to purchase an investment property as co-owners and take title as joint tenants. All of the following are true EXCEPT:,all four will enjoy equal rights of possession of the property.,all four will have equal interests in the property.,all four will acquire their interests at the same time.,the four friends will each receive a separate deed for their share.,D,"All concurrent ownership is created by one deed, which will establish either joint tenancy or tenants in common. Additionally, joint tenancy requires that four unities must be present: possession, interest, title, and time (PITT)."
A mechanic's lien would be properly classified as a(n),equitable lien.,voluntary lien.,specific lien.,general lien.,C,"A mechanic's lien is a specific lien as it affects a specific property and only that particular property. It is an involuntary lien placed on a property without the owner's consent. A general lien is the right of a creditor to have all of an owner's property, real and personal, sold to satisfy a debt. An equitable lien arises out of a written contract that shows the intention of the parties to charge a particular property as a security for a debt or obligation."
Which of the following liens usually would be given highest priority in disbursing funds from a foreclosure sale?,A judgment rendered the day before foreclosure,A mechanic's lien for work started before the mortgage was made,A mortgage dated last year,Unpaid real estate property taxes,D,"Unpaid real estate property taxes have first priority and ""move to the head of the line"" when property is liquidated at a foreclosure sale. They are a statutory lien with priority over liens created by contract, such as mortgages. Unpaid real estate property taxes take priority over mechanic's liens and judgments, no matter when those liens were recorded."
The owner has a large parcel of land surveyed into lots and streets and files a subdivision plat. Each lot can be legally described by use of which of the following?,Government survey,Lot and block system,Street address,Metes-and-bounds system,B,The lot and block system is often used to describe property in subdivisions. The rectangular government survey system divides land into rectangles and describes those rectangles with principal meridians and base lines. The metes-and-bounds system outlines the perimeter of a parcel by starting at one point and ending at the same point. A street address is not a legal property description.
"Neighbor A uses Neighbor B's driveway to reach A's garage, which is on their property. B's attorney explains that ownership rights of A's real estate includes an easement appurtenant giving them the right to use B's driveway. In this case, B's property is the",dominant tenement.,licensed property,leasehold interest.,servient tenement.,D,"In an appurtenant easement the parcel over which the easement runs is known as the servient tenement, and the neighboring parcel that benefits from the easement is known as the dominant tenement. B's property is the servient tenement, and A's is the dominant tenement. The easement does not create a leasehold estate. A license is a personal privilege with permission from a landowner to enter the land for a specific purpose."
Which of the following terms refers to sole ownership by one person?,Joint Tenancy,Tenancy in Common,Community Property,Severalty,D,Severalty ownership is ownership by one person severed and cut-off from all others. Tenancy in common and tenancy by the entirety are forms of joint ownership. Community property is personal or real property belonging to spouses according to state laws.
A section in the rectangular survey system contains,640 acres per section.,36 townships.,160 acres per section.,160 government lots.,A,"The answer is 640 acres per section. Each township contains 36 sections, and each section is 1 square mile, or 640 acres per section."
"A seller lists her property with a local broker, and the listing agreement excludes the seller's prized Iris flowers planted in the garden. The broker lists the exclusion in the MLS and notes it on the property brochure. But when a buyer makes an offer on the property, the plants are not mentioned anywhere in the contract. The seller accepts the offer. At closing, who has possession of the Iris plants?","The buyer, since they are personal property that transfers with the title","The seller, since personal property must be included to convey","The seller, since they were excluded in the listing and MLS","The buyer, since they are improvements to the land",D,"Landscaping is considered to be an improvement and, once attached, is an appurtenance which transfers with the land via the deed. In this question, the seller excludes the Iris plants on the listing which implies they are planted, or otherwise appurtenant to the property. Since the seller forgot to exclude the plants in the purchase contract, which is what determines the legal status of appurtenant items, the plants would likely be considered appurtenant and would transfer with the property to the buyer."
"A tenant's lease has expired, but the tenant has not vacated the premises or negotiated a renewal lease. The landlord has not given the tenant permission to remain in the building. This situation is an example of:",tenancy at sufferance.,an estate for years.,an estate from period to period.,tenancy at will.,A,"Tenancy (estate) at sufferance occurs when a tenant who lawfully possessed real property continues in possession of the premises without the landlord's consent after the lease rights expire, typically from an estate for years. An estate from period to period automatically renews unless notice is given. A tenancy at will permits a tenant to possess property with the landlord's consent for an unspecified term. An estate for years is a leasehold estate that continues for a definite period, whether that period is days, weeks, months, or years and has a definite expiration date."
The principal difference between an estate for years and an estate from period to period is that an,estate for years is a life estate.,estate from period to period has no expiration date.,estate for years cannot be terminated.,estate from period to period must be in writing.,B,"An estate from period to period, or periodic tenancy, does not have a specific expiration date, as it automatically renews until notice is given by the tenant or landlord. An estate (tenancy) for years has specific beginning and ending dates. Neither estate is a life estate. Each can be terminated. Both an estate for years and an estate from period to period must be in writing to be enforceable."
"Three friends were concurrent owners of a parcel of real estate. One of the friends died, and his interest passed according to his will to become part of his estate. The deceased friend was a",tenant by the entirety.,joint tenant.,severalty owner.,tenant in common.,D,"In a tenancy in common, the property of a deceased owner may pass to the heirs according to the will. If the deceased owner had been a joint tenant, the property would not have passed according to the will because in a joint tenancy the property interests would have transferred directly to the other two friends (co-tenants). The deceased owner was not a tenant by the entirety, a category reserved for married couples. Nor was the deceased owner a severalty owner because that form of ownership requires property to be held by only one person."
"A general contractor recently filed suit against a homeowner for nonpayment. The contractor now learns that the homeowner has listed the property for sale with a real estate broker. In this situation, which of the following will the contractor's attorney use to protect the contractor's interest?",Assessment,Lis pendens,Buyer's lien,Mortgage lien,B,"A recorded lis pendens (a notice of action pending) warns any potential purchaser that a property is subject to a pending legal action. This notice would prompt a buyer to consider very carefully whether to proceed, but it would not absolutely prevent it. The contractor may also have the right to use a mechanic's lien to obtain payment. The lis pendens would give notice until the mechanic's lien was in place. An assessment is a special levy for a definite purpose, such as adding curbs or sewers in a neighborhood. A mortgage lien is a voluntary specific lien the borrower signs."
"To create joint tenancy in the ownership of real estate, there must be unities of","title, interest, encumbrance, and survivorship.","ownership, possession, heirs, and title.","possession, interest, time, and title.","grantees, ownership, claim of right, and possession",C,"The equal interests of possession, interest, and title must all occur at the same time for joint tenancy to be created. REMEMBER: PITT for the unities of title in joint tenancy."
Which of the following is TRUE of condominium ownership?,The association pays the unit income taxes,The common elements cannot be sold separately,The association pays the unit real estate taxes,The ownership of a unit cannot be willed,B,"Although an individual unit owner owns an interest in the common elements as a tenant in common, they may not be sold separately by a unit owner; unit owners do not have the same right to partition that other tenants in common have. Individual owners pay the real estate taxes for their units. Condominium owners may will or mortgage their fee simple ownership in a condominium."
A purchaser of real estate learns that his ownership rights could continue forever and that no other person claims to be the owner or has any ownership control over the property. This person owns a,fee simple interest.,qualified fee estate.,life estate.,remainder interest.,A,"Fee simple is an absolute ownership, an inheritable interest ""with no strings attached."" A life estate is a non-inheritable freehold estate that ends with the death of the owner or the death of some other designated person. A remainder interest is tied to a life estate. A qualified fee estate exists as long as a determined use of the property continues."
A tenant who holds possession of a landlord's property without a definite lease term but with the consent of the landlord has a,tenancy at will.,tenancy at sufferance.,holdover tenancy.,tenancy in common.,A,An estate (tenancy) at will gives the tenant the right to possess property with the landlord's consent for an unspecified term. It continues until it is terminated by either party giving notice. A tenancy at sufferance arises when a tenant continues to possess the property without the landlord's consent after the tenant's rights expire. Tenancy in common is a form of co-ownership in which each owner holds an undivided interest in a property as if each were the sole owner. A holdover tenancy is created when a tenant with an estate for years holds on to a property after the lease term expires when no new lease has been signed.
A parcel of property was purchased by two friends. The deed they received from the seller at closing conveyed the property by name to each of the two friends without further explanation. The friends took title as which of the following?,Tenants in common,Community property owners,Tenants by the entirety,Joint tenants,A,"The answer is tenants in common. When joint tenancy is not clearly stated in the deed, grantees take title as tenants in common to avoid the results of accidental joint tenancy. Friends are unable to hold community property or be tenants by the entirety as those forms of ownership are available only for married couples."
A title search for a property under contract has revealed several outstanding liens against the property. Which of the following liens has highest priority?,A special assessment for the current year,A property tax lien for the current year,A judgment lien rendered and recorded last month,An outstanding first mortgage lien dated and recorded one year ago,B,"Tax liens have priority over previously recorded liens and over a special assessment, which will also take priority over previously recorded liens. The priority of the other liens will be based on the dates they were recorded. Liens recorded first will have a first right to payment or priority."
"When defining ownership estates, the term estate refers to:",a person's legal rights in the land or property.,residential properties over twenty-five acres.,only the possessionary rights of tenants and owners.,the quantity of land as shown on a plat map for a property.,A,"With respect to property ownership, the word estate refers to a person's legal use or the bundle of rights in land which, depending upon the type of estate, include the right to possess, transfer, encumber, et cetera. Estates are not tied to the physical quantity or the value of the land itself. A fee simple estate is the highest estate one can hold in land since it has the most or maximum rights to the land."
The type of real estate ownership that is MOST all-inclusive is a,qualified fee estate.,life estate.,reversionary interest.,fee simple absolute estate.,D,A fee simple absolute estate is the highest interest in real estate recognized by law. Fee simple ownership is absolute ownership in which the holder is entitled to all rights to the property. A life estate is a freehold estate that lasts as long as the life of the life tenant. A qualified fee estate is limited by specific conditions created by agreement or by law. A reversionary interest is that interest in property that exists when ownership of a life estate reverts back to the original owner at the end of the life estate.
Under which type of lien are both the real property and the personal property of the debtor sold to pay the debt?,Judgment lien,Mechanic's lien,Assessment lien,Real estate tax lien,A,"A judgment is a general, involuntary, equitable lien on both real and personal property owned by the debtor. A mechanic's lien is a specific lien against real property filed by a contractor, subcontractor, or supplier when an owner or contractor has not paid for work or supplies for improvements on a property. A real estate tax lien is a statutory lien against real property for nonpayment of taxes. An assessment lien is a special assessment levied on real property to fund public improvements to property."
"A married couple owns a farm together, with the right of survivorship. Their ownership is MOST likely",severalty ownership.,a tenancy by the entirety.,community property.,a tenancy in common.,B,"A married couple, in certain states, may use a special form of co-ownership called tenancy by the entirety. Each spouse has an equal, undivided interest in the property, with the right of survivorship. Severalty ownership occurs when real estate is owned by one person only. Tenancy in common and community property forms of ownership do not include the right of survivorship (in most states)."
An owner purchased an interest in a house in a resort beach community. The owner is entitled to the right of possession only between July 10 and August 4 of each year. Which type of ownership MOST likely has been purchased?,Condominium,Cooperative,Time-share,Trust,C,"The owner holds an interest in property for a stated time each year, sharing the property according to a specified time plan. The owner's interest is a time-share. The owner of a condominium or a cooperative has a right of possession for as long as the ownership is not transferred. An individual does not own property through a trust, as a trust holds title to the real estate."
