Question,A,B,C,D,Correct Answer,Feedback / Explanation
Two owners have separate deeds but equal ownership. What form of ownership is this?,Joint tenants,Tenants in common,Tenants by entirety,Lessor and lessee,B,Tenants in common allows each owner to hold a separate deed while sharing ownership.
"Red River, a navigable stream, forms the boundary between farmer Brown's property and that of a neighbor, Smith. Neighbor Smith allows a canoeist to cross the property to gain access to the river. The water traffic annoys farmer Brown. Does Brown have the right to stop the canoeist from using the river?","No, since Red River is a navigable stream.","Yes, since Brown is a riparian owner and owns to the center of the stream.","Yes, since Brown is a riparian owner and owns the bed of the stream.","Since Brown is a riparian owner, he owns the stream to the middle and can prevent the canoeist from using his one-half of the stream.",B,Riparian owners on navigable streams own to the center line and may restrict access to their half.
Which of the following cannot be depreciated for tax purposes?,Land,Buildings,Machinery,Office buildings,A,"Land is not subject to wear and tear, so it cannot be depreciated."
What is the best way to determine if there is an encroachment on your property?,Survey,Title search,Title insurance,Affidavit of title,A,A survey precisely shows boundaries and reveals encroachments.
A zoning law states that no structure on any lot can be constructed within 15 feet of the lot line. One owner obtained a one-time approval from the zoning board to build to a point 10 feet from the lot line. What did the zoning board grant that owner?,Building permit,Variance,Non-conforming use permit,Spot zoning permit,A,A variance allows deviation from zoning requirements for one property.
"In real estate sales, when a cooperating sub-agent performs acts, the agent is:",Not responsible since they are with another company.,Responsible only if they know of the acts.,Fully responsible for the acts of the sub-agent.,Partially responsible for the acts of the sub-agent.,B,An agent is liable if they are aware of the sub-agents improper acts.
Destruction of subject property terminates the agency relationship by:,Consent of the agent and principal,Reliction by the agent,Operation of law,Renunciation by the principal,C,Loss of the property ends the agency automatically by law.
"Property owned by James was sold at a tax sale. He may regain full ownership by payment of the taxes, interest, and other charges within a specified time. What is this process called?",Redemption,Repossessing,Accretion,Equitable right,C,The statutory right of redemption lets an owner reclaim property after a tax sale.
What is usually true of contracts made by minors?,They are enforceable by all parties.,They are bilateral.,They are voidable by the vendee.,They are voidable by the vendor.,A,"Minors can enforce contracts, but others cannot enforce against them without their consent."
An easement passes over an Smiths land to allow Jones access to an adjacent parcel owned by Jones. What term would apply to Jones land?,Number one estate,Servient estate,Dominant estate,Easement appurtenant,C,The dominant estate benefits from the easement.
Which of the following would be considered a violation of the Fair Housing Act of 1968?,A private club owns a building for the use of its members only and refuses to rent a unit to a couple who are not members.,A man who only owns one home refuses to sell to a man of Asian descent.,A man who owns four houses refuses to rent to a woman with two children.,"A lender refuses to make a loan to Mr. Jack, an African American male, because Mr. Jack has been unemployed for several months and has a history of unemployment.",C,Refusing to rent to a family with children is discrimination based on familial status.
"If the principal instructs the broker-in-charge to violate the law, what should the broker-in-charge do?",Refuse to obey and give the principal the name of another brokerage that would probably do as instructed.,Should do as instructed.,Should withdraw from the transaction.,Proceed very carefully to avoid prosecution.,C,The broker must withdraw to avoid participating in illegal acts.
What law allows borrowers who have been denied credit to view the credit report that was used to make the determination?,Equal Credit Opportunity Act,Sherman -Clayton Act,Fair Credit Reporting Act,Civil Rights Act,C,The Fair Credit Reporting Act gives the right to review credit reports used in decisions.
Why may a license be suspended or revoked?,For making unkind remarks about your competition.,For working for the Buyer and the Seller.,For fraudulent misrepresentation in a real estate transaction.,For refusing to join the Board of Realtors.,C,Fraud in a real estate transaction is grounds for loss of license.
"If a group of competing real estate brokers-in-charge created a ""fee schedule"" of commission rates that all the brokerages agreed to follow, what law would they be violating?",Sherman Anti-trust Act,Code of Ethics,South Carolina Commission Act,Uniform Commercial Code Act,A,Price-fixing among competitors violates the Sherman Antitrust Act.
Which action may the South Carolina Real Estate Commission take?,"Suspend, revoke or cancel any license it issues.",Imprison a violator of the license laws.,Both fine and imprison violators of license laws.,Fine a licensee a maximum of $1000.,A,"The Commission can discipline by suspending, revoking, or canceling licenses."
Wha may cause a licensee to lose their license?,Buying listed properties as an undisclosed principal.,Failing to be employed on a full-time basis.,Soliciting door to door.,Sharing commissions with licensed parties.,A,Failing to disclose when buying property for oneself is prohibited.
The Fair Housing Act has as its primary purpose the:,Elimination of prejudice.,Creation of equal but separate housing.,Creating of minority employment in the United States.,Creation and assurance of fair housing opportunities for everyone.,D,It ensures equal housing opportunities regardless of protected classes.
When applying for a VA loan the veteran must have a document from the Veteran's Administration stating that the veteran is eligible for the loan. This is called a/an:,CRV,Certificate of Eligibility,Certificate of Service,Certificate of Reasonable Value,B,The Certificate of Eligibility proves the veteran qualifies for a VA loan.
"Under the law of contracts when something remains to be done, the contract is said to be a/an ____________contract. When all the conditions of the contract have been met, the contract is said to be a/an ____________contract.",Executory - executed,Executed - executory,Implied -express,Unilateral -bilateral,A,An executory contract is incomplete; executed means fully performed.
In what type of contract do both parties promise to perform specified acts?,Unilateral contract,Option contract,Bilateral contract,Executory contract,C,A bilateral contract contains mutual promises from both sides.
Broker Betty wants to show a property. Betty finds out that a competing brokerage has an exclusive right to sell listing on the property. How should Betty proceed?,Contact the owner directly.,Ask permission from listing agent to show the property.,Hold off until the listing expires.,Advise her customer that state law requires her to be a "Buyer's Agent.",B,Permission from the listing agent is required to show the property.
Which of the following statements is true concerning a "Quitclaim Deed"?,It carries no warranties or covenants.,It warrants that there are no covenants except those recorded.,"It warrants against encumbrances, if any, which are known to the grantor.",It warrants against encumbrances known by the grantee.,A,Quitclaim deeds transfer any interest without warranties.
"If the owner of a property solicits a buyer and sells the property to that buyer while you have an exclusive agency listing, how much commission do you receive?",No commission.,The commission shown in the listing agreement that you would get if you sold the property.,The split stated in the cooperating agency agreement.,On half of the stated commission.,A,Exclusive agency allows the owner to sell directly without paying commission.
What is the primary purpose of the South Carolina Real Estate Commission?,Collect fees and issue licenses.,Issue license through police power.,Protect citizens in the real estate business.,Protect the public through police power.,D,The Commissions purpose is to protect the public interest.
"George pays Dan a sum of money which gives George the right to buy a specific parcel from Dan, within a specified period, and for a specific price. Dan remains in possession of the property. What has George acquired?",A land contract,A purchase money mortgage,A lease-purchase,An option,D,An option is the right to buy at set terms within a certain time.
"A right, benefit, or improvement, that belongs to and becomes part of the real estate is best described as a/an:",Appurtenance,Amenity,Chattel,License,A,An appurtenance is a right or improvement attached to and passing with the property.
A lawsuit in which am African American man was denied the right to purchase a home because of his race became a landmark civil rights decision because it reaffirmed the 1866 Civil Rights Act. What is the name of this case?,Smith vs. Western,Jones vs. Mayer,White vs. Plumber,Brown vs. Murphy,B,Jones v. Mayer confirmed no racial discrimination in property sales.
What is the experience requirement to become a broker in South Carolina?,Six months with an active Associate license,One year with an active Associate license,Five of the past seven years with an Associate license,Three of the past five years with an Associate license,C,SC requires 5 years as a licensed salesperson in the last 7 years.
What is an unlicensed administrative employee of a broker-in-charge allowed to do?,Sell property if it is done under the broker-in-charges direct supervision.,Sell or negotiate deals if they are done in the office.,Refer interested customers to the broker-in-charge or other licensed individuals in the office.,Show property if price is not discussed.,C,Unlicensed staff can refer prospects to a licensee but not sell or negotiate.
"Once they have completed the 60-hour Unit I Pre-License course, how long do students have to wait before they can take the 30-hour Unit II Advanced Principles course?",Six months,Until they pass the State licensing exam,Twelve months,They may take it immediately,D,Both courses can be taken back-to-back with no wait required.
Where does the South Carolina Real Estate Commission receive its police power to protect the public?,The State Legislature,The SC Real Estate Commission,The Department of Labor Licensing and Regulation,The Federal Government,A,The state legislature grants the Commissions authority.
Who would not be required to have a real estate license?,Part time real estate agent,Party selling neighbors home for a fee,Full time real estate auctioneer,Attorney selling a client's property in connection with other legal duties,D,Attorneys acting within their duties are exempt from licensing.
Which is not a duty of the South Carolina Real Estate Commission?,Examining applicants.,Promulgating regulations governing the real estate business.,Issuing licenses.,Arbitrating disputes among licensees.,D,The Commission does not arbitrate disputes between licensees.
"Roberts leaves town and a neighbor, Smiley, sells Roberts' home with Roberts' permission and charges no fee. Which choice is true?",Smiley has broken no law.,Smiley is guilty of a misdemeanor.,Smiley should have charged a reasonable fee,Roberts can be fined for his actions in this matter.,A,Selling without compensation and without license does not violate license law.
"A party living in an open, notorious, and hostile manner on a parcel of land for the time prescribed by law may, under some circumstances, gain title through what process?",Squatters rights,Constructive notice,Prescription,Adverse possession,D,Adverse possession allows legal title after statutory occupation period.
"When an supervised licensee leaves a brokerage, the broker-in-charge should take what action?",Allow the license to expire and not renew since they don't work there anymore.,Give the license to the supervised licensee.,Notify the Board of Realtors.,Return the license to the Real Estate Commission.,D,The broker must return the license to the SC Real Estate Commission.
What is the intended benefit of the truth-in-lending portion of the Truth-in-Lending Integrated Disclosure (TRID) legislation?,To protect lenders.,It protects borrowers by allowing them to compare the cost of borrowing from various firms.,It protects borrowers from paying exorbitant interest rates.,It protects both borrowers and lenders from frivolous lawsuits.,B,It allows borrowers to compare loan terms from different lenders.
How do appraisers normally obtain the square footage of single-family detached homes?,By measuring from the inside,From the title search,From comparables in the neighborhood,By measuring from the exterior,D,Exterior measurements are standard for determining square footage.
A building supply company that delivered shingles to a construction site and did not get paid by the builder may file a ______________.,Tax lien,Special assessment,Mechanics lien,Variance,C,A mechanics lien protects suppliers for unpaid materials or labor.
"Bo owns a large tract of land, and his home is next to the road. Bo sells the back part of his lot to John. At the time of the sale Bo gave John the right to use a 20-foot strip of land across his property for a driveway. This is an _______________.",Encroachment,Easement appurtenance,Easement by necessity,Easement by prescription,B,Easement appurtenant benefits the back lot and runs with the land.
"What do we call any claim, charge, or liability which attaches to and is binding on the real estate is?",Lien,Tax deed,Mortgage,Encumbrance,D,An encumbrance is any burden or limitation on property rights.
Through a condemnation suit the government may acquire private property and convert it to public use under the power of ________________.,Police,Condemnation,Eminent domain,Highest and best use,C,Eminent domain is the power to take property with compensation.
A permissive use that gives no rights to the user because it can be revoked at any time is known as a/an _______________.,License,Encroachment,Restricted covenant,Nonconforming use,A,A license is temporary and can be revoked at will.
All the following are private control of property except which one?,CC & Rs,Conditions,Deed restrictions,Zoning ordinances,D,Zoning ordinances are public (government) controls.
A property use that was legal in the beginning but is now in violation of the current zoning regulations would be a:,Variance,Rezoning,Spot zoning,Non-conforming use,D,Non-conforming use is grandfathered from before zoning changed.
"The document that shows a short history of the title, including the chain of title, would be the ______________.",Abstract of title,Certificate of title,Title insurance policy,Grantor-grantee index,A,An abstract summarizes the chain of title and recorded documents.
All the following are requirements for a valid deed except which one?,Signing by grantee,Signing by grantor,Granting clause,Definite grantee,A,Only the grantor must sign; grantees signature not required.
What type of deed creates the greatest liability for the grantor?,Quitclaim deed,General warranty deed,Special warranty deed,Bargain and sale deed,B,General warranty deed guarantees title against all defects forever.
What type of deed provides warranty by a prior owner only after they acquired title?,Quitclaim deed,Special warranty deed,Bargain and sale deed,General warranty deed,B,Special warranty limits guarantees to the grantors period of ownership.
Title insurance would normally cover all the following except for:,Unrecorded liens,Forged documents,Incompetent grantors,Changes in land use brought about by zoning,D,Zoning changes are not insurable title defects.
"What is the covenant in a general warranty deed whereby the grantor promises to compensate the grantee for any loss suffered because of the condition of the title, other than disclosed encumbrances?",Of quiet enjoyment,Of further assistance,Of warranty forever,Against encumbrances,C,Warranty forever promises to defend title against claims.
"When a grantor gives a document to transfer a possible interest in the property, which clears up defects in the title, the grantee might receive a ________________.",Limited warranty deed,Quitclaim deed,Title insurance,Warranty deed,B,"Quitclaim deeds release any interest, clearing potential title issues."
"When a person dies intestate and with no heirs found, the state has a reversionary interest called ________________.",Escheat,Condemnation,Eminent domain,Remainder estate,A,Escheat returns property to the state when no heirs exist.
The procedures used to record real estate title documents are governed by ________________.,State laws,Acts of Congress,Title company regulations,Rules of various federal regulatory agencies,A,Recording is regulated at the state level.
A recorded deed must have all but which of the following?,Encumbrances,Acknowledgement,Testimonium clause,Delivery and acceptance,A,A deed need not list encumbrances to be valid for recording.
Cities and counties incorporate their long-term land usage goals into what types of documents?,Mission Statements,Zoning Ordinances,Building Codes,Master plan,D,A master plan guides future growth and land use.
The legal premise underlying the definition of littoral rights is that a lake or sea,is not a navigable body of water,should be available to the owner for unrestricted use,is a navigable body of water,is owned by the abutting owners,c,"The legal premise underlying the definition of littoral rights is that a lake or sea is a navigable body of water and, therefore, public property owned by the state"
"Three unique physical characteristics of land are immobility, indestructibility and",heterogeneity,air rights,surface rights,personalty,a,"Land has three unique physical characteristics: immobility, indestructibility, and heterogeneity.  It cannot be moved, destroyed or identical to any other property"
Land cannot be homogenous because,it is indestructible,a parcel of land cannot be moved,no two parcels are alike,no two owners are identical,c,Land is non-homogeneous since no two parcels of land are exactly the same. They are inherently different because each parcel has a unique location
Which of the following concepts is associated with the term real property?,Bundle of rights,Personal property,Intangible property,Chattels,a,Real property is ownership of real estate and the bundle of rights associated with owning the real estate
Which of the following statements is true regarding the bundle of rights?,An owner cannot transfer subsurface rights without transferring air rights,An owner can transfer subsurface rights without transferring air rights,An owner cannot relinquish the right to own the subsurface rights,An owner can never divide the bundle of rights.,b,"The bundle of real property rights also applies separately to the individual components of real estate: the air, the surface, and the subsurface. An owner can, for example, transfer subsurface rights without transferring air rights"
Which of the following is an example of a trade fixture?,A grocers food freezers,A propertys roof,An assigned parking space,Solar panels,a,"Trade fixtures, or chattel fixtures, are items of a tenant's personal property that the tenant has temporarily affixed to a landlord's real property in order to conduct business. Examples of trade fixtures include a grocer's food freezers, a merchant's clothes racks, a tavern owner's bar, a dairy's milking machines, and a printer's printing press"
Plants and crops that grow naturally without requiring anyone's labor or machinery are considered ,emblements,trade fixtures,real property,personal property,c,Plants and crops that grow naturally without requiring anyone's labor or machinery are considered real property. Plants and crops requiring human intervention and labor are called emblements
The conversion of real property to personal property effected by detaching it from the real estate is known as,severance,chattel,attachment,affixing,a,"Severance is the conversion of real property to personal property by detaching it from the real estate, such as by cutting down a tree, detaching a door from a shed, or removing an antenna from a roof"
Which of the following statements regarding the conversion of property is true?,The classification of an item of property as real or personal is not necessarily fixed,The classification of property can never be changed by the process of conversion,The conversion of real property to personal property is not possible,The conversion of personal property to real property is not possible,a,The classification of an item of property as real or personal is not necessarily fixed. The classification may be changed by the process of conversion
"Real estate includes such things as fences, streets, buildings, wells, sewers, sidewalks, and piers. Such man-made structures attached to the land are called",chattels,emblements,trade fixtures,improvements,d,"Real estate includes, in addition to land, such things as fences, streets, buildings, wells, sewers, sidewalks, and piers. Such man-made structures attached to the land are called improvements"
The ownership of real estate and the bundle of rights associated with owning the real estate is defined as,personal property,real property,air rights,subsurface rights,b,Real property is ownership of real estate and the bundle of rights associated with owning the real estate
Which of the following is an example of tangible property?,Stock certificates,Contracts,Listing agreements,Real property,d,"All real estate, by its physical nature, is tangible property. Personal property may be tangible or intangible. Boats, jewelry, coins, appliances, computers, and art work are examples of tangible personal property. Stocks, copyrights, bonds, trademarks, patents, franchises, and listing agreements are examples of intangible personal property"
The right to ____________ the property includes the right to mortgage the property as collateral for debt,enjoy,transfer,encumber,use,c,"The right to encumber the property includes the right to mortgage the property as collateral for debt. There may be restrictions to this right, such as a spouse's right to limit the degree to which a homestead may be mortgaged"
"Since water is a resource necessary for survival, some states -- particularly those where water is scarce -- have taken the legal position that the state owns and controls all bodies of water. Which of the following applies to property owners that must obtain permits for the use of water?",Doctrine of Prior Appropriation,Doctrine of Littoral Rights,Doctrine of Riparian Rights,Zoning Permit,a,"Called the Doctrine of Prior Appropriation, this legality requires that property owners obtain permits for use of water. If a proposed usage is reasonable and beneficial, the state will grant a permit which, over time, can attach to the property of the permit holder"
"If a body of water is entirely contained within the boundaries of an owner's property,  the owner would have which of the following rights?",Littoral rights,Riparian rights,Restricted rights of usage,Unrestricted rights of usage ,d,"The legal premise underlying the definition of littoral rights is that a lake or sea is a navigable body of water and, therefore, public property owned by the state. By contrast, a body of water entirely contained within the boundaries of an owner's property is not navigable. In such a case, the owner would own the water as well as unrestricted rights of usage"
Which of the following statements is true regarding a property owners littoral rights? ,The ownership extends to the low watermark of the body of water,The ownership extends to the high watermark of the body of water,The owner enjoys unrestricted use of the water and owns the land beneath,The owner owns the land beneath the body of water to the waters midstream,b,"Owners of properties abutting a navigable, non-moving body of water enjoy the littoral right of use but do not own the water nor the land beneath the water. Ownership extends to the high-water mark of the body of water"
The primary criterion for distinguishing real property from personal property is,whether the item is permanently attached to the land or the structure,the original cost of the item,whether the item was included in the previous sale of the property,whether the item will be included in the listing agreement,a,The primary criterion for distinguishing real from personal property is whether the item is permanently attached to the land or structures attached to the land
The act of converting personal property to real property by attaching it to real estate is known as,severance,affixing,not possible,accession,b,"Affixing, or attachment, is the act of converting personal property to real property by attaching it to the real estate, such as by assembling a pile of bricks into a barbecue pit, or constructing a boat dock from wood planks"
Which of the following is the primary regulatory entity for the real estate brokerage business?,Federal government,State government,County government,Local government,b,"State governments are the primary regulatory entities of the real estate brokerage business. State governments establish real estate license laws and qualifications. In addition, state governments have established real estate commissions to administer license laws and oversee activities of licensees"
