Question,A,B,C,D,Correct Answer,Feedback / Explanation
The purpose of a covenant clause in a deed of conveyance is to,state the grantor's assurance or warrant to the grantee that a certain condition or fact concerning the property is true,state the grantee's promise to use the property in a prescribed manner,warrant that the grantor has never encumbered title,describe the consideration that the grantee promises to give in return for title,a,Covenant clauses present the grantor's assurances to the grantee
The type of statutory deed that contains the most complete protection for the grantee is a,guardian's deed,special warranty deed,general warranty deed,quitclaim deed,c,"The general warranty deed, or warranty deed for short, is the most commonly used deed. It contains the fullest possible assurances of good title and protection for the grantee"
"A person wishes to convey any and all interests in a property to another without making any assurances as to encumbrances, liens, or any other title defects on the property. This party would most likely use which of the following types of deed?",A sheriff's deed,A special warranty deed,A partition deed,A quitclaim deed,d,"A quitclaim deed. A quitclaim deed transfers real and potential interests in a property, whether an interest is known to exist or not.  The grantor makes no claim to any interest in the property being conveyed and offers no warrants to protect the grantee"
A one-time tax levied on a property for purposes of recording a transaction is called,an intangible sales tax,a documentary stamp tax,an ad valorem tax,a franchise tax,b,State law usually requires payment of a documentary stamp tax on a conveyance of real property
"If a person dies with no legal heirs or relations and has left no valid will, what happens to real property owned by that person?",It is taken by the state according to the process called escheat,It is reconveyed to the previous owner in the chain of title,It is taken by the title insurance company according to the process called involuntary alienation,It is conveyed to the highest bidder at a public auction,a,"It is taken by the state according to the process called escheat, or reverts, to the state or county after all claims and debts have been validated and settled"
"Just prior to passing away, a person tells two witnesses that she would like her estate to pass to her husband. One witness records the statement and signs his name. This is an example of",an enforceable holographic will,an unenforceable holographic will,an enforceable nuncupative will,an unenforceable nuncupative will,d,"An unenforceable nuncupative will, made orally, and written down by a witness; generally not valid for the transfer of real property"
"If a person having several heirs dies intestate, the property will",pass to heirs by the laws of descent and distribution,escheat to the state,pass to the surviving spouse through elective share,pass to the surviving heirs according to the provisions of the will,a,"If the decedent died without a valid will, the estate passes to lawful heirs according to the state's laws of descent and distribution, or succession"
A property owner can avert the danger of losing title by adverse possession by,recording proof of ownership in county title records,inspecting the property and evicting any trespassers found,claiming hostile and notorious possession,filing a claim of right with the county recorder,b,"An owner can avert the danger of involuntary alienation by adverse possession by periodically inspecting the property within statutory deadlines and evicting any trespassers found. The owner may also sue to quiet title, which would eliminate the threat of the adverse possessor's claim to legal title"
"A hermit secretly lives in a cave on a 200-acre property. After twenty years, the person makes a claim of ownership to the property. This claim will likely be",upheld through adverse possession,upheld because of the length of possession,declined through the doctrine of prior appropriation,declined because possession was secretive,d,"State laws may allow a real property owner to lose legal title to an adverse possessor. An adverse possessor is someone who enters, occupies, and uses another's property without the knowledge or consent of the owner, or with the knowledge of an owner who fails to take any action over a statutory period of time. To claim legal title, the adverse possessor must have notorious possession, which is possession without concealment"
The fundamental purpose of recording instruments that affect real property is to,prove ownership of the property,avoid adverse possession,give constructive notice of one's rights and interests in the property,assemble all relevant documents in a single place,c,"State laws require the recording of all documents that affect rights and interests in real estate in the public real estate records of the county where the property is located. These public records, or title records, contain a history of every parcel of real estate in the county, including names of previous owners, liens, easements, and other encumbrances that have been recorded. Title records protect the public by giving all concerned parties constructive notice of the condition of a property's legal title: who owns the property, who maintains claims and encumbrances against the property"
What is "chain of title?",The list of all parties who have ever owned real estate,The bundle of rights linked to the recorded title to a parcel,A chronology of successive owners of record of a parcel of real estate,Involuntary conveyance of title by statutory rules of descent,c,Chain of title refers to the succession of owners of record dating back to the original grant of title from the state to a private party. It is thus more than a mere list; it is a chronological list as reflected in title records
The Torrens System differs from other title recording systems in that,title is conveyed only when conveyance is registered on the title certificate,the Torrens System requires prior approval of a transaction before it can be registered,the Torrens System is not recognized by title insurance companies,it allows unrecorded encumbrances to cloud title,a,The Torrens system differs from other title recording systems in that title passes only when the conveyance has been duly registered on the title certificate itself
"To be marketable, title must be",registered in Torrens,free of undisclosed defects and encumbrances,abstracted by an attorney,guaranteed by a title certificate,b,"Marketable title is, by definition, one that is free and clear of undesirable and unknown encumbrances, claims, clouds, or other defects. Attorney's abstracts and title certificates do not guarantee that a title is marketable"
"With the exception of a Torrens certificate, the best evidence of marketable title is",a signed deed,a title certificate,title insurance,an attorney's opinion,c,A title insurance policy is commonly accepted as the best evidence of marketable title. A title insurance policy indemnifies the policy holder against losses arising from defects in the insured title
A property owner who possesses all ownership interest owns,equitable title,legal title,abstract title,quiet title,b,"Owning title to real property commonly connotes owning the complete bundle of rights that attach to the property, including the right to possession.  In turn, someone who possesses all ownership interests owns legal title to the property"
"A mortgage loan transaction gives the lender the right to execute a strict foreclosure, which transfers legal title to the lender in the event of a default. With this contractual right, which type of title does the lender hold?",Equitable title,Legal title,Nuncupative title,Clouded title,a,"Equitable title is the interest or right to obtain legal title to a property in accordance with a sale or mortgage contract between the legal owner and a buyer or creditor. During the contractual period of time, when ownership of legal title is contingent upon the contract, the buyer or lender owns equitable title to the property.  With this contractual right, the lender has equitable title to the property"
The term "notice" is synonymous with,knowledge,constructive,legal,alienation,a,A person who has received actual notice has actual knowledge of something. Receiving actual notice means learning of something through direct experience or communication
"When the transfer of title to real estate uses a written instrument, the transfer is called",a constructive notice,an actual notice,a conveyance,an estoppel,c,The use of a written instrument to transfer title to real estate is called a conveyance
Which of the following is an example of a voluntary transfer of title to real estate?,Foreclosure,Escheat,By deed,Adverse possession,c,Voluntary alienation is an unforced transfer of title by sale or gift from an owner to another party. A deed is the legal instrument used to effect a voluntary transfer of title to real estate
Involuntary alienation occurs primarily by the process of,descent and distribution,public grant,transfer by will,reconveyance deed,a,"Involuntary alienation is a transfer of title to real property without the owner's consent. Involuntary alienation occurs primarily by the processes of descent and distribution, escheat, foreclosure, eminent domain, adverse possession, and estoppel"
A deed is a legal instrument used by an owner.  The owner in a conveyance is also known as the,grantor,grant,mortgagor,mortgagee,a,"A deed is a legal instrument used by an owner, the grantor, to transfer title to real estate voluntarily to another party, the grantee"
Which of the following statements applies if a grantee loses the deed?,The grantor can reclaim the property,There is no effect on the grantees title to the estate,Whoever finds the deed will automatically own the property,The grantee will lose the title to the estate by escheat,b,"If the grantee loses the deed, there is no effect on the grantee's title to the estate. The grantor, for example, cannot reclaim the estate on the grounds that the grantee has lost the deed after it was delivered and accepted"
Which of the following statements is true regarding the effect of recording a deed?,Recording is necessary to make a deed valid,Recording is not necessary to make a deed valid,Recording the deed gives actual notice of the grantees ownership,Recording a deed is not in the grantee's best interest,b,"Recording is not necessary to make a deed valid. However, it is in the grantee's best interest to do so. Recording the deed gives the public constructive notice of the grantee's ownership"
The habendum clause,recites restrictions and limitations to the estate being conveyed,assures the grantor owns the estate to be conveyed,identifies the property being conveyed,describes the type of estate being conveyed,d,"The habendum clause describes the type of estate being conveyed (fee simple, life, etc.)"
A deed which conveys to the grantee the promise from the grantor that I own and will defend against my acts only has received which of the following deeds?,Bargain and sale deed,General warranty deed,Special warranty deed,Quitclaim deed,c,"In a special warranty deed, the grantor warrants only against title defects or encumbrances not noted on the deed that may have occurred during the grantor's period of ownership or trusteeship"
Which of the following statements is true about quitclaim deeds?,The quitclaim deed is typically used to clear title rather than convey it,The quitclaim deed covenant claims that the title will be defended in court,The quitclaim deed is the same as a special warranty deed,The quitclaim deed contains the warrant of seisin,a,"The quitclaim is typically used to clear title rather than convey it. Where there is a possibility that prior errors in deeds or other recorded documents might cloud (encumber) the title, the relevant parties execute a quitclaim deed to convey ""any and all"" interest to the grantee"
A valid last will and testament for the transfer of real property will generally take which of the following forms?,Holographic,Undocumented,Disproved,Secretively,a,"A will can take on one of the following forms:  witnessed, holographic (in the testators handwriting, dated and signed), approved or nuncupative"
"A single parent died intestate, leaving four surviving children. In this case, the estate passes to the lawful heirs according to the states laws of",escheat,descent and distribution,testate probate,eminent domain,b,"If the decedent died without a valid will, the estate passes to lawful heirs according to the state's laws of descent and distribution, or succession"
"To claim legal title, the adverse possessor must have",notorious possession,a sales contract,an eviction notice,proof of purchase,a,"To claim legal title, the adverse possessor must have notorious possession, which is possession without concealment"
Which of the following prevents a person from claiming a right or interest that is inconsistent with the person's previous statements or acts?,Estoppel,Injunction,Warranty,Deed,a,"Estoppel prevents a person from claiming a right or interest that is inconsistent with the person's previous statements or acts. As a basis for involuntary alienation, the doctrine of estoppel can prevent an owner from re-claiming a property that was transferred under false pretenses"
"To demonstrate marketable title to a buyer, a seller must show that the",title is encumbered,title is free of defects,property is not located on a floodplain,property has been advertised,b,"To demonstrate marketable title to a buyer, a seller must show that the title is free of defects, such as a judgment lien"
"Generally, an attorneys title abstract is which of the following?",The attorneys proof that title has cleared,The attorneys guarantee that the property is not encumbered,The attorneys opinion of the condition of the property,The attorneys opinion of the condition of title,d,"An attorney's title abstract is a summary of an attorneys examination of a propertys title history.  The abstract also renders the attorney's opinion of the condition and marketability of the title. Generally, an opinion is not a proof or guarantee of clear title. Further, it offers no protection in the event title turns out to be defective"
"Which of the following is a summary of the condition of title as of the date of the certificate, based on a search of public records by a title analyst?",Abstract of title,Equitable title,Title certificate,Title insurance,c,"A title certificate is a summary of the condition of title as of the date of the certificate, based on a search of public records by an abstractor or title analyst. The certificate does not guarantee clear title against defects, unrecorded encumbrances or encroachments"
Which two terms are often used interchangeably?,Equitable title and legal title,Legal title and title,Contract for deed and abstract title,Quiet title and legal title,b,"In practice, the terms ""title"" and ""legal title"" are often used interchangeably"
The transfer of title to real estate is also called,title.,actual notice,legal notice,alienation,d,"Transfer of title to real estate, also called alienation, occurs voluntarily and involuntarily"
A living owner makes a private grant utilizing which of the following?,Transfer by will,Constructive notice,Deed of conveyance,Involuntary alienation,c,"A living owner makes a private grant by means of a deed of conveyance, or deed. A private grant that occurs when the owner dies is a transfer by will"
"Unless the deed contains special provisions, the deed must be signed by the",grantor,grantee,atorney,agent,a,"The deed must be signed by the grantor, but need not be signed by the grantee unless the deed contains special provisions requiring the grantee's acceptance. Grantors may give power of attorney to other parties, authorizing them to execute deeds on their behalf"
Which of the following statement is true regarding the conveyance of the title?,The execution of a valid deed in itself does not convey title,The delivery of the deed is enough to convey the title,The title will be conveyed regardless of acceptance by the grantee,The grantor can reclaim the property if the grantee loses the deed,a,Execution of a valid deed in itself does not convey title. It is necessary for the deed to be delivered to and accepted by the grantee for title to pass
Which of the following is the only required conveyance clause?,Habendum clause,Tenendum clause,Granting clause,Reddendum clause,c,"Conveyance clauses and covenant, or warrant, clauses set forth all the necessary provisions of the conveyance. Granting clauses, or premises clause are the only required clause. The granting clause contains the conveyance intentions; names the parties; describes the property; indicates nominal consideration"
The covenant in a deed that assures that the grantee will not be disturbed by third party title disputes is known as the,warrant of seisin,warrant of quiet enjoyment,warranty forever,warranty against grantors acts,b,"The warrant of quiet enjoyment assures that the grantee will not be disturbed by third party title disputes. another party, the grantee"
"The covenant in a deed that assures that the grantor owns the estate to be conveyed, and has the right to do so is known as the",warrant of seisin,warrant of quiet enjoyment,warranty forever,warranty against grantors acts,a,"The warrant of seisin assures that the grantor owns the estate to be conveyed, and has the right to do so"
The overall general warranty covenant is,"""I own, but won't defend.""","""I own and will defend against my acts only.""","""I may or may not own, and I won't defend.""","""I own and will defend.""",d,"The general warranty deed, or warranty deed for short, is the most commonly used deed. It contains the fullest possible assurances of good title and protection for the grantee. The overall general warranty covenant is: ""I own and will defend."""
The overall special warranty covenant is,"""I own, but won't defend.""","""I own and will defend against my acts only.""","""I may or may not own, and I won't defend.""","""I own and will defend.""",b,"In a special warranty deed, the grantor warrants only against title defects or encumbrances not noted on the deed that may have occurred during the grantor's period of ownership or trusteeship. The overall special warranty covenant is: ""I own and will defend against my acts only."""
"If a party responsible for encumbering title refuses to quitclaim the interest, the owner may file which of the following?",Partition suit,Quiet title suit,Lawsuit,Quitclaim deed,b,"If a party responsible for encumbering title refuses to quitclaim the interest, the owner may file a quiet title suit. This requires the lienor to prove the validity of an interest. If the defendant is unable to do so, the court removes the cloud by decree"
An owner can avert the danger of involuntary alienation by taking which of the following action?,Recording a quit claim deed,Suing to quiet title,Registering the property with the recorder of deeds,Obtaining an estoppel,b,"An owner can avert the danger of involuntary alienation by adverse possession by periodically inspecting the property within statutory deadlines and evicting any trespassers found. The owner may also sue to quiet title, which would eliminate the threat of the adverse possessor's claim to legal title"
Notorious possession and hostile possession give _______________ to the public,claim of right,no notice,actual notice,constructive notice ,d,"Notorious possession and hostile possession give constructive notice to the public, including the legal owner, that a party other than the legal owner is occupying and claiming to own the property"
"To claim the legal title, the adverse possessor must",be able to show a color of title as a reason for the possession,prove ownership with a quit claim deed,have a written signed lease agreement allowing for the use of the property,register the property in the Torrens system,a,"A claim of right is based on the adverse possessor's occupying and maintaining the property as if he or she were the legal owner. Color of title results when a grantee has obtained defective title, or received title by defective means, but occupies the property as if he or she were the legal owner. A court may hold that a claim of right or a claim of colored title is a valid reason for the possession"
"Which of the following contains the history of every parcel of real estate in the county, including names of previous owners, liens, easements, and other encumbrances?",Abstract of title,Clerk of the circuit court,Title records,Title insurance,c,"The public records, or title records, contain a history of every parcel of real estate in the county, including names of previous owners, liens, easements, and other encumbrances that have been recorded"
All of the following are evidence of title EXCEPT,an estoppel,a title insurance policy,an attorneys opinion of the abstract,a title certificate,a,Estoppel prevents a person from claiming a right or interest that is inconsistent with the person's previous statements or acts. It is not evidence of title
"Homeowners associations (HOAs) are bodies, usually established by developers, that determine rules and regulations for the operation of a housing development. The rules are presented in",the developers mandate handbook.,a HOAs candidate handbook.,"a Declaration of Covenants, Conditions, and Restrictions (CC&Rs)","a Declaration of Demands, Requirements and Reservations (DR&Rs)",c,"Homeowners associations (HOAs) are bodies, usually established by developers, that determine rules and regulations for the operation of a housing development. The rules are presented in a Declaration of Covenants, Conditions, and Restrictions (CC&Rs) for the development and in association by-laws.  An HOA may not impose a rule that conflicts with the law or violates homeowner rights. Infringements of rules and regulations may be enforced by the action of a civil court."
Someone who possesses all ownership interests in real property owns,equitable title to the real property,legal title to the real property,equitable and legal title to the real property,statutory title to the real property,b,"Someone who possesses all ownership interests owns legal title to the property. Legal title is distinct from equitable title, which is the interest or right to obtain legal title to a property in accordance with a sale or mortgage contract between the legal owner and a buyer or creditor"
The question of who owns title to a property is generally a function of,who has a bill of sale for the property,who has physical possession of the property,who has the best evidence of ownership,who has a deed for the property,c,Ownership of legal title is a function of evidence. A court will generally rule that the person who has the preponderance of evidence of ownership is the owner of the property
Which of the following best describes actual notice?,It is notice published in a newspaper,It is knowledge one could have or should have obtained,It is notice explicitly stated in a legal document,It is knowledge received or imparted through direct experience,d,"Actual Notice of ownership is completed by providing direct evidence of ownership, such as a valid will showing an inheritance of the property, or a deed, or by an examination of county records or by simply visiting the property to see who is in possession"
Which of the following best describes constructive notice?,It is notice published in a newspaper,It is knowledge one could have or should have obtained,It is notice explicitly stated in a legal document,It is knowledge received or imparted through direct experience,b,"Constructive notice, or legal notice, is knowledge of a fact that a person could have or should have obtained. The foremost method of imparting constructive notice is by recordation of ownership documents in public records, specifically, title records"
Title can be voluntarily transferred by,"grant, deed, and will","escheat, deed, and covenant","title certificate, will, and deed","sale contract, deed, and warrant of seizin",a,"A living owner makes a private grant by means of a deed of conveyance, or deed. A private grant that occurs when the owner dies is a transfer by will"
"The owner of a property creates a deed, leaving the name of the grantee blank, and puts it in a drawer, where it is forgotten for several years.  One day, a visitor finds the deed, fills in his name as grantee, and attempts to record it.  However, the owner will probably have no trouble disputing the validity of the deed because",the grantee was not competent at the time of delivery,"there was no intent to deliver it, and no consideration was given",the grantee did not sign it at the time of execution,it was not accompanied by a transfer certificate,b,"To be valid, a deed must be accompanied by valuable (monetary) or good (love and affection) consideration, and the grantor must declare before a notary or other authorized person that the grantor's identity and signature are genuine, and that the deed execution was a free, voluntary act"
What is the function of recording a deed?,It makes the deed valid,It causes title to pass,It gives constructive notice of ownership,It removes all prior recorded encumbrances,c,"Recording is not necessary to make a deed valid. However, it is in the grantee's best interests to do so. Recording the deed gives the public constructive notice of the grantee's ownership"
